{
  "$schema": "https://json-schema.org/draft/2020-12/schema",
  "$id": "https://igreja12.invalid/schemas/migration-history-divergence-remediation-proposal-v3.json",
  "$defs": {
    "blocked_environment_track": {
      "additionalProperties": false,
      "properties": {
        "append_only_behavior_evidence": {
          "const": "PENDING_SEPARATE_EVIDENCE"
        },
        "cutover_decision": {
          "const": "BLOCKED"
        },
        "data_api_evidence": {
          "const": "PENDING_SEPARATE_PLATFORM_EVIDENCE"
        },
        "environment_attestation": {
          "const": "NOT_COMPLETE_FOR_V3"
        },
        "legacy_evidence_classification": {
          "enum": [
            "BLOCKED_EVIDENCE_INSUFFICIENT",
            "BLOCKED_LEDGER_DIVERGENCE"
          ]
        },
        "legacy_ledgers_action": {
          "const": "PRESERVE_WITHOUT_BACKFILL_OR_REWRITE"
        },
        "manual_dev_index_drift_inferred_in_prod": {
          "const": false
        },
        "manual_index_drift_reference": {
          "const": "manual_dev_index_drift"
        },
        "realtime_evidence": {
          "const": "PENDING_SEPARATE_PLATFORM_EVIDENCE"
        },
        "schema_and_data_evidence": {
          "const": "PENDING_SEPARATE_ENVIRONMENT_EVIDENCE"
        }
      },
      "required": [
        "append_only_behavior_evidence",
        "cutover_decision",
        "data_api_evidence",
        "environment_attestation",
        "legacy_evidence_classification",
        "legacy_ledgers_action",
        "realtime_evidence",
        "schema_and_data_evidence"
      ],
      "type": "object"
    },
    "false_permissions": {
      "additionalProperties": false,
      "properties": {
        "capture_allowed": {
          "const": false
        },
        "database_access_allowed": {
          "const": false
        },
        "database_mutation_allowed": {
          "const": false
        },
        "deploy_allowed": {
          "const": false
        },
        "environment_attestation_execution_allowed": {
          "const": false
        },
        "environment_operation_allowed": {
          "const": false
        },
        "index_change_allowed": {
          "const": false
        },
        "ledger_backfill_allowed": {
          "const": false
        },
        "migration_application_allowed": {
          "const": false
        },
        "runner_change_allowed": {
          "const": false
        },
        "runner_execution_allowed": {
          "const": false
        },
        "runtime_change_allowed": {
          "const": false
        }
      },
      "required": [
        "capture_allowed",
        "database_access_allowed",
        "database_mutation_allowed",
        "deploy_allowed",
        "environment_attestation_execution_allowed",
        "environment_operation_allowed",
        "index_change_allowed",
        "ledger_backfill_allowed",
        "migration_application_allowed",
        "runner_change_allowed",
        "runner_execution_allowed",
        "runtime_change_allowed"
      ],
      "type": "object"
    },
    "sha256": {
      "pattern": "^[0-9a-f]{64}$",
      "type": "string"
    }
  },
  "additionalProperties": false,
  "properties": {
    "amendment": {
      "additionalProperties": false,
      "properties": {
        "amendment_reason": {
          "const": "ATTESTATION_V1_RECLASSIFIED_AS_BLOCKED_ENVELOPE_AND_KNOWN_DEV_INDEX_DRIFT_REQUIRES_SEPARATE_EVIDENCE"
        },
        "historical_artifacts_remain_unchanged": {
          "const": true
        },
        "prior_human_records_apply_to_proposal_id": {
          "const": "migration-history-divergence-remediation-proposal-v1"
        },
        "prior_human_records_reused_for_v3": {
          "const": false
        },
        "supersedes_proposal_id": {
          "const": "migration-history-divergence-remediation-proposal-v2"
        },
        "supersedes_sha256": {
          "$ref": "#/$defs/sha256"
        }
      },
      "required": [
        "amendment_reason",
        "historical_artifacts_remain_unchanged",
        "prior_human_records_apply_to_proposal_id",
        "prior_human_records_reused_for_v3",
        "supersedes_proposal_id",
        "supersedes_sha256"
      ],
      "type": "object"
    },
    "artifact_state": {
      "const": "OFFLINE_EPOCH_CUTOVER_DECISION_PACKAGE_BLOCKED"
    },
    "contract_version": {
      "const": "3.0"
    },
    "current_permissions": {
      "$ref": "#/$defs/false_permissions"
    },
    "environment_tracks": {
      "additionalProperties": false,
      "properties": {
        "DEV": {
          "$ref": "#/$defs/blocked_environment_track"
        },
        "PROD": {
          "$ref": "#/$defs/blocked_environment_track"
        }
      },
      "required": [
        "DEV",
        "PROD"
      ],
      "type": "object"
    },
    "epoch_strategy": {
      "additionalProperties": false,
      "properties": {
        "automatic_backfill": {
          "const": "PROHIBITED"
        },
        "cross_environment_decision_reuse": {
          "const": "PROHIBITED"
        },
        "historical_inference": {
          "const": "PROHIBITED"
        },
        "legacy_ledgers": {
          "const": "PRESERVE_AS_INDEPENDENT_HISTORICAL_RECORDS"
        },
        "manual_dev_drift_treatment": {
          "const": "PRESERVE_AND_VERSION_FORWARD_ONLY_AFTER_SEPARATE_ATTESTATION_REVIEW_AND_HUMAN_DECISION"
        },
        "recommended": {
          "const": "CONTROLLED_EPOCH_CUTOVER_AFTER_COMPLETE_SEPARATE_EVIDENCE"
        },
        "status": {
          "const": "RECOMMENDATION_ONLY_NOT_APPROVED"
        },
        "target_implementation": {
          "const": "NOT_DESIGNED_OR_AUTHORIZED"
        }
      },
      "required": [
        "automatic_backfill",
        "cross_environment_decision_reuse",
        "historical_inference",
        "legacy_ledgers",
        "manual_dev_drift_treatment",
        "recommended",
        "status",
        "target_implementation"
      ],
      "type": "object"
    },
    "evidence_gates": {
      "additionalProperties": false,
      "properties": {
        "APPEND_ONLY_BEHAVIOR": {
          "type": "object"
        },
        "DATA_API": {
          "type": "object"
        },
        "ENVIRONMENT_SCHEMA_AND_DATA": {
          "type": "object"
        },
        "INDEPENDENT_REVIEW": {
          "type": "object"
        },
        "MANUAL_DEV_INDEX_DRIFT": {
          "type": "object"
        },
        "REALTIME": {
          "type": "object"
        }
      },
      "required": [
        "APPEND_ONLY_BEHAVIOR",
        "DATA_API",
        "ENVIRONMENT_SCHEMA_AND_DATA",
        "INDEPENDENT_REVIEW",
        "MANUAL_DEV_INDEX_DRIFT",
        "REALTIME"
      ],
      "type": "object"
    },
    "historical_evidence": {
      "additionalProperties": false,
      "properties": {
        "attestation_v1": {
          "type": "object"
        },
        "canonical_derivation": {
          "type": "object"
        },
        "source_catalog": {
          "type": "object"
        },
        "v1_proposal_sha256": {
          "$ref": "#/$defs/sha256"
        },
        "v2_proposal_sha256": {
          "$ref": "#/$defs/sha256"
        }
      },
      "required": [
        "attestation_v1",
        "canonical_derivation",
        "source_catalog",
        "v1_proposal_sha256",
        "v2_proposal_sha256"
      ],
      "type": "object"
    },
    "manual_dev_index_drift": {
      "additionalProperties": false,
      "properties": {
        "basenames": {
          "items": {
            "pattern": "^idx_[a-z0-9_]+$",
            "type": "string"
          },
          "maxItems": 7,
          "minItems": 7,
          "type": "array",
          "uniqueItems": true
        },
        "catalog_application_inferred": {
          "const": false
        },
        "classification": {
          "const": "KNOWN_UNVERIFIED_DRIFT"
        },
        "current_presence_attested": {
          "const": false
        },
        "definition_hashes_attested": {
          "const": false
        },
        "environment": {
          "const": "DEV"
        },
        "forward_only_requirement": {
          "const": "PRESERVE_AND_VERSION_ONLY_AFTER_SEPARATE_EVIDENCE_AND_APPROVAL"
        },
        "prior_report_is_current_environment_proof": {
          "const": false
        },
        "provenance": {
          "const": "PRIOR_OPERATOR_REPORT_ONLY"
        },
        "prod_presence_inferred": {
          "const": false
        }
      },
      "required": [
        "basenames",
        "catalog_application_inferred",
        "classification",
        "current_presence_attested",
        "definition_hashes_attested",
        "environment",
        "forward_only_requirement",
        "prior_report_is_current_environment_proof",
        "provenance",
        "prod_presence_inferred"
      ],
      "type": "object"
    },
    "next_gate": {
      "additionalProperties": false,
      "properties": {
        "authorized": {
          "const": false
        },
        "id": {
          "const": "REVIEW_AND_CI_OFFLINE_AGENT_FOUNDATION_BATCH_PR"
        },
        "scope": {
          "const": "OFFLINE_BATCH_REVIEW_AND_CI_ONLY_NO_CUTOVER_AUTHORIZATION"
        }
      },
      "required": [
        "authorized",
        "id",
        "scope"
      ],
      "type": "object"
    },
    "next_stage_authorized": {
      "const": false
    },
    "operational_authorization": {
      "const": false
    },
    "proposal_id": {
      "const": "migration-history-divergence-remediation-proposal-v3"
    },
    "repository_base_sha": {
      "const": "0f8c6a77bf489f9080743ab3f7ce71097d361aea"
    },
    "review": {
      "additionalProperties": false,
      "properties": {
        "current_independent_review_complete": {
          "const": false
        },
        "current_review_state": {
          "const": "PENDING_INDEPENDENT_REVIEW_OF_V3"
        },
        "human_cutover_decision": {
          "const": "NOT_MADE"
        },
        "prior_human_records_apply_to_proposal_id": {
          "const": "migration-history-divergence-remediation-proposal-v1"
        },
        "prior_human_records_reused_for_v3": {
          "const": false
        }
      },
      "required": [
        "current_independent_review_complete",
        "current_review_state",
        "human_cutover_decision",
        "prior_human_records_apply_to_proposal_id",
        "prior_human_records_reused_for_v3"
      ],
      "type": "object"
    },
    "runner_contract": {
      "additionalProperties": false,
      "properties": {
        "apply_migrations_sha256": {
          "$ref": "#/$defs/sha256"
        },
        "commands_remain_blocked": {
          "const": [
            "bootstrap-ledger",
            "harden-ledger",
            "status",
            "apply"
          ]
        },
        "must_remain_unchanged_in_this_mission": {
          "const": true
        },
        "proposal_is_not_a_runner_input": {
          "const": true
        },
        "reconciliation_verifier_sha256": {
          "$ref": "#/$defs/sha256"
        }
      },
      "required": [
        "apply_migrations_sha256",
        "commands_remain_blocked",
        "must_remain_unchanged_in_this_mission",
        "proposal_is_not_a_runner_input",
        "reconciliation_verifier_sha256"
      ],
      "type": "object"
    }
  },
  "required": [
    "amendment",
    "artifact_state",
    "contract_version",
    "current_permissions",
    "environment_tracks",
    "epoch_strategy",
    "evidence_gates",
    "historical_evidence",
    "manual_dev_index_drift",
    "next_gate",
    "next_stage_authorized",
    "operational_authorization",
    "proposal_id",
    "repository_base_sha",
    "review",
    "runner_contract"
  ],
  "title": "Migration history divergence remediation proposal v3",
  "type": "object"
}
